{
  "version": "1.1.0",
  "source_file": "event.mov",
  "delivered_file": "event_delivered.mp4",
  "hashes": {
    "source_sha256": "abc123",
    "delivered_sha256": "def456",
    "metadata_released_sha256": "ghi789"
  },
  "redaction_profile": "redact",
  "redactions": ["QuickTime:GPSCoordinates"],
  "timestamp": 1700000000,
  "security": {
    "sign_official": true,
    "official_key_fingerprint": "TODO_OFFICIAL_FPR",
    "sign_user": false,
    "user_key_fingerprint": null,
    "log_hash": true,
    "log_url": "TODO_LOG_URL"
  }
}
